<?xml version="1.0" encoding="ISO-8859-1"?>

<!DOCTYPE AmnesiaConfiguration SYSTEM "Configuration/amnesia.dtd">
<?xml-stylesheet type="text/css" href="teste.css"?>
<AmnesiaConfiguration>
    <Processor>
        <processorContains>0</processorContains>
        <createTraceFile>0</createTraceFile>
    </Processor>
    <Trace>
        <wordSize>4</wordSize>
    </Trace>
    <CPU>
        <wordSize>4</wordSize>
    </CPU>
    <MainMemory>
        <blockSize>2</blockSize>
        <memorySize>16</memorySize>
        <ciclesPerAccessRead>1</ciclesPerAccessRead>
        <ciclesPerAccessWrite>2</ciclesPerAccessWrite>
        <timeCicle>10</timeCicle>
    </MainMemory>
	<Cache>
        <cacheType>Unified</cacheType>
        <unifiedCache>
            <lineSize>2</lineSize>
            <ciclesPerAccessRead>1</ciclesPerAccessRead>
            <ciclesPerAccessWrite>2</ciclesPerAccessWrite>
            <timeCicle>1</timeCicle>
            <memorySize>16</memorySize>
            <associativityLevel>8</associativityLevel>
            <writePolicy>WriteThrough</writePolicy>
            <replacementAlgorithm>FIFO</replacementAlgorithm>
        </unifiedCache>
    </Cache>
	<VirtualMemory>
        <pageSize>4</pageSize>
        <diskMemorySize>16</diskMemorySize>
        <diskCiclesPerAccessRead>1</diskCiclesPerAccessRead>
        <diskCiclesPerAccessWrite>2</diskCiclesPerAccessWrite>
        <timeCicle>100</timeCicle>
        <pageTableReplacementAlgorithm>FIFO</pageTableReplacementAlgorithm>
        
		<TLBType>unified</TLBType>
		<unifiedTLB>
			<memorySize>2</memorySize>
			<ciclesPerAccessRead>1</ciclesPerAccessRead>
			<ciclesPerAccessWrite>2</ciclesPerAccessWrite>
			<timeCicle>1</timeCicle>
			<replacementAlgorithm>FIFO</replacementAlgorithm>
		</unifiedTLB>
	</VirtualMemory>
</AmnesiaConfiguration>